label,message
0,sad story of a man last week was my bday my wife didnt wish me my parents forgot n so did my kids i went to work even my colleagues did not wish
0,dont give a flying monkeys wot they think and i certainly dont mind any friend of mine and all that
0,what is this hex place you talk of explain
0,a boy was late 2 home his father power of frndship
1,sppok up ur mob with a halloween collection of nokia logopic message plus a free eerie tone txt card spook to 8007
1,urgent call 09066612661 from landline your complementary 4 tenerife holiday or 10000 cash await collection sae tcs po box 3 wa14 2px 150ppm 18 sender hol offer
0,easy mate guess the quick drink was bit ambitious
1,you have won a guaranteed 1000 cash or a 2000 prize to claim yr prize call our customer service representative on 08714712412 between 10am7pm cost 10p
0,let me know how to contact you ive you settled in a room lets know you are ok
0,ugh fuck it im resubbing to eve
1,74355 xmas iscoming ur awarded either 500 cd gift vouchers free entry 2 r 100 weekly draw txt music to 87066 tnc
0,long beach lor expected u having dinner now
0,night has ended for another day morning has come in a special way may you smile like the sunny rays and leaves your worries at the blue blue bay gud mrng
0,can come my room but cannot come my house cos my house still messy haha
1,u r a winner u ave been specially selected 2 receive 1000 cash or a 4 holiday flights inc speak to a live operator 2 claim 0871277810710pmin 18
0,great to hear you are settling well so whats happenin wit ola
0,hai priya are you right what doctor said pa where are you
1,sorry u can not unsubscribe yet the mob offer package has a min term of 54 weeks pls resubmit request after expiry reply themob help 4 more info
0,cool so how come you havent been wined and dined before
0,tmrw im finishing 9 doors
0,dude sux for snake he got old and raiden got buff
0,aslamalaikkuminsha allah tohar beeen muht albi mufti mahfuuzmeaning same here
0,every mondaynxt week vl be completing
0,i wonder if youll get this text
0,no no i will check all rooms befor activities
0,ltgt of pple marry with their lovers becz they hav gud undrstndng dat avoids problems i sent dis 2 u u wil get gud news on friday by d person you like and tomorrow will be the best day of your life dont break this chain if you break you will suffer send this to ltgt frnds in ltgt mins whn u read
0,but you dint in touch with me
0,kay since we are out already
0,easy ahsen got selected means its good
0,my uncles in atlanta wish you guys a great semester
0,dearregret i cudnt pick calldrove down frm ctla now at cochin homeleft mobile in carente style ishtamayoohappy bakrid
0,sorry ill call later
0,we have sent jd for customer service cum accounts executive to ur mail id for details contact us
0,you have come into my life and brought the sun shiny down on me warming my heart putting a constant smile on my face making me feel loved and cared for
0,nothing much chillin at home any super bowl plan
1,sms services for your inclusive text credits pls goto wwwcomuknet login unsubscribe with stop no extra charge help08700469649 po box420 ip4 5we
0,how are you doing hope youve settled in for the new school year just wishin you a gr8 day
0,i promise to take good care of you princess i have to run now please send pics when you get a chance ttyl
0,can u look 4 me in da lib i got stuff havent finish yet
0,yo guess what i just dropped
0,once a fishrman woke early in d mrng it was very dark he waited a while amp found a sack ful of stones he strtd throwin thm in2 d sea 2 pass time atlast he had jus 1stone sun rose up amp he found out tht those r nt stones those were diamonds moraldont wake up early in d mrng good night
0,purity of friendship between two is not about smiling after reading the forwarded messageits about smiling just by seeing the name gud evng
0,send me yettys number pls
0,joys father is john then john is the of joys father if u ans ths you hav ltgt iq tis s ias question try to answer
0,sorry man my stash ran dry last night and i cant pick up more until sunday
0,crucify is c not s you should have told me earlier
0,no go no openings for that room til after thanksgiving without an upcharge
0,package all your programs well
1,private your 2003 account statement for shows 800 unredeemed s i m points call 08715203652 identifier code 42810 expires 29100
0,can all decide faster cos my sis going home liao
0,compliments to you was away from the system how your side
0,oh okie lorwe go on sat
0,yes last practice
0,i donno if they are scorable
0,ranjith cal drpd deeraj and deepak 5min hold
1,jamster to get your free wallpaper text heart to 88888 now tc apply 16 only need help call 08701213186
0,yeah in fact he just asked if we needed anything like an hour ago when and how much
0,aah a cuddle would be lush id need lots of tea and soup before any kind of fumbling
0,no other valentines huh the proof is on your fb page ugh im so glad i really didnt watch your rupaul show you tool
0,it shall be fine i have avalarr now will hollalater
0,good morning my dear have a great amp successful day
0,long after i quit i get on only like 5 minutes a day as it is
0,are you free nowcan i call now
0,i want to be inside you every night
0,r u sam p in eachother if we meet we can go 2 my house
0,i can probably come by everybodys done around ltgt right
0,x2 ltgt are you going to get that
0,i was just callin to say hi take care bruv
0,i wnt to buy a bmw car urgentlyits vry urgentbut hv a shortage of ltgt lacsthere is no source to arng dis amt ltgt lacsthats my prob
0,height of confidence all the aeronautics professors wer calld amp they wer askd 2 sit in an aeroplane aftr they sat they wer told dat the plane ws made by their students dey all hurried out of d plane bt only 1 didnt move he saidif it is made by my studentsthis wont even start datz confidence
0,it doesnt make sense to take it there unless its free if you need to know more wikipediacom
0,i got it before the new year cos yetunde said she wanted to surprise you with it but when i didnt see money i returned it mid january before the ltgt day return period ended
0,aight fuck it ill get it later
0,yeah my usual guys out of town but therere definitely people around i know
0,your opinion about me 1 over 2 jada 3 kusruthi 4 lovable 5 silent 6 spl character 7 not matured 8 stylish 9 simple pls reply
1,for ur chance to win 250 cash every wk txt play to 83370 tscs wwwmusictrivianet custcare 08715705022 1x150pwk
0,wake me up at ltgt am morning
0,thats cool sometimes slow and gentle sonetimes rough and hard
0,i am literally in bed and have been up for like ltgt hours
0,i am at a party with alex nichols
0,anything lar then not going home 4 dinner
0,yar lor how u noe u used dat route too
0,well shes in for a big surprise
0,oh the grand is having a bit of a party but it doesnt mention any cover charge so its probably first come first served
0,1 go to write msg 2 put on dictionary mode 3cover the screen with hand 4press ltgt 5gently remove ur hand its interesting
0,give one miss from that number please
0,wat time u finish ur lect today
1,urgent your mobile number has been awarded a ukp2000 prize guaranteed call 09061790125 from landline claim 3030 valid 12hrs only 150ppm
0,yeah we can probably swing by once my roommate finishes up with his girl
0,hey pple700 or 900 for 5 nightsexcellent location wif breakfast hamper
0,tell my bad character which u dnt lik in me ill try to change in ltgt i ll add tat 2 my new year resolution waiting for ur replybe frankgood morning
0,not able to do anything
0,she said do u mind if i go into the bedroom for a minute ok i sed in a sexy mood she came out 5 minuts latr wid a caken my wife
1,you have won a nokia 7250i this is what you get when you win our free auction to take part send nokia to 86021 now hgsuite3422lands roww1jhl 16
1,sms auction a brand new nokia 7250 is up 4 auction today auction is free 2 join take part txt nokia to 86021 now
0,it so happens that there r 2waxsto do wat you want she can come and ill get her medical insurance and shell be able to deliver and have basic care im currently shopping for the right medical insurance for her so just give me til friday morning thats when ill see the major person that can guide me to the right insurance
0,yeah wheres your class at
0,die i accidentally deleted e msg i suppose 2 put in e sim archive haiz i so sad
0,good afternoon sunshine how dawns that day are we refreshed and happy to be alive do we breathe in the air and smile i think of you my love as always
0,bill as in are there any letters for me im expecting one from orange that isnt a bill but may still say orange on it
0,sorry ill call later
1,please call 08712402578 immediately as there is an urgent message waiting for you
0,your account has been refilled successfully by inr ltdecimalgt your keralacircle prepaid account balance is rs ltdecimalgt your transaction id is kr ltgt
0,dude we should go sup again
0,never try alone to take the weight of a tear that comes out of ur heart and falls through ur eyes always remember a stupid friend is here to share bslvyl
0,detroit the home of snow enjoy it
0,yes we are chatting too
0,r comin back for dinner
0,i am in hospital da i will return home in evening
0,sorry sir i will call you tomorrow senthilhsbc
0,good afternoon loverboy how goes you day any luck come your way i think of you sweetie and send my love across the sea to make you smile and happy
1,dear voucher holder have your next meal on us use the following link on your pc 2 enjoy a 2 4 1 dining experiencehttpwwwvouch4mecometlpdiningasp
1,forwarded from 21870000hi this is your mailbox messaging sms alert you have 4 messages you have 21 matches please call back on 09056242159 to retrieve your messages and matches
0,hope you are having a great day
0,im there and i can see you but you cant see me maybe you should reboot ym i seen the buzz
0,mmm thats better now i got a roast down me id b better if i had a few drinks down me 2 good indian
0,i keep ten rs in my shelf buy two egg
0,hi dahow is the todays class
1,hey boys want hot xxx pics sent direct 2 ur phone txt porn to 69855 24hrs free and then just 50p per day to stop text stopbcm sf wc1n3xx
0,they released vday shirts and when u put it on it makes your bottom half naked instead of those white underwear
0,if i get there before you after your ten billion calls and texts so help me god
0,okey dokey ill be over in a bit just sorting some stuff out
0,yeah confirmed for you staying at that weekend
0,dad went out oredi
0,i wonder how you got online my love had you gone to the net cafe did you get your phone recharged were you on a friends net i think of you boytoy
0,have you got xmas radio times if not i will get it now
0,i am joining today formallypls keep prayingwill talk later
0,just got part nottingham 3 hrs 63miles good thing i love my man so much but only doing 40mph hey ho
0,how long before you get reply just defer admission til next semester
0,sfine anytime all the best with it
0,my sis is catching e show in e afternoon so im not watching w her so c u wan 2 watch today or tmr lor
0,no my blankets are sufficient thx
0,webpage s not available
0,wherres my boytoy
1,you have been specially selected to receive a 2000 pound award call 08712402050 before the lines close cost 10ppm 16 tcs apply ag promo
0,no prob i will send to your email
0,k k then watch some films
0,let me know when youve got the money so carlos can make the call
0,i can but it will tell quite long cos i havent finish my film yet
0,left dessert u wan me 2 go suntec look 4 u
0,oic then better quickly go bathe n settle down
0,then she buying today no need to c meh
0,they said if its gonna snow it will start around 8 or 9 pm tonite they are predicting an inch of accumulation
1,winner as a valued network customer you have been selected to receivea 900 prize reward to claim call 09061701461 claim code kl341 valid 12 hours only
0,im at work please call
0,carlos says we can pick up from him later so yeah were set
0,were gonna go get some tacos
1,private your 2004 account statement for 07742676969 shows 786 unredeemed bonus points to claim call 08719180248 identifier code 45239 expires
0,good afternoon my love how goes that day i hope maybe you got some leads on a job i think of you boytoy and send you a passionate kiss from across the sea
0,hurry up ive been weeddeficient for like three days
0,yeah work is fine started last week all the same stuff as before dull but easy and guys are fun
1,cds 4u congratulations ur awarded 500 of cd gift vouchers or 125 gift guaranteed freeentry 2 100 wkly draw xt music to 87066 tncs wwwldewcom1win150ppmx3age16
0,hello damn this christmas thing i think i have decided to keep this mp3 that doesnt work
1,urgent call 09066350750 from your landline your complimentary 4 ibiza holiday or 10000 cash await collection sae tcs po box 434 sk3 8wp 150 ppm 18
0,pick ur fone up now u dumb
0,s daal r above ltgt
0,love isnt a decision its a feeling if we could decide who to love then life would be much simpler but then less magical
0,you stayin out of trouble strangersaw dave the other day hes sorted nowstill with me bloke when u gona get a girl mrur mum still thinks we will get 2getha
0,i surely dont forgot to comei will always be in touch in with you
1,u have a secret admirer who is looking 2 make contact with ufind out who they rreveal who thinks ur so specialcall on 09058094599
0,petey boy whereare you me and all your friendsare in thekingshead come down if you canlove nic
0,no its not pride im almost ltgt years old and shouldnt be takin money from my kid youre not supposed to have to deal with this stuff this is grownup stuffwhy i dont tell you
0,thanks for sending this mental ability question
0,ill get there tomorrow and send it to you
0,hi this is roger from cl how are you
1,dear voucher holder to claim this weeks offer at your pc please go to httpwwwwtlpcouktext tscs apply
0,wat r u doing
0,great so what attracts you to the brothas
1,we tried to contact you re your reply to our offer of a video handset 750 anytime networks mins unlimited text camcorder reply or call 08000930705 now
0,thats good because i need drugs
0,ahhh work i vaguely remember that what does it feel like lol
0,what do u want when i come backa beautiful necklace as a token of my heart for youthats what i will give but only to my wife of my likingbe that and seeno one can give you thatdont call mei will wait till i come
0,thanks for this hope you had a good day today
0,shb b ok lor thanx
1,bears pic nick and tom pete and dick in fact all types try gay chat with photo upload call 08718730666 10pmin 2 stop texts call 08712460324
0,shes find i sent you an offline message to know how anjolas now
0,just arrived see you in a couple days lt3
0,chk in ur belovd ms dict
0,hello how r u im bored inever thought id get bored with the tv but i am tell me something exciting has happened there anything
0,hey mr whats the name of that bill brison book the one about language and words
0,yes i thought so thanks
0,hiya comin 2 bristol 1 st week in april les got off rudi on new yrs eve but i was snoringthey were drunk u bak at college yet my work sends ink 2 bath
0,yes i will be there glad you made it
0,hi my engagement has been fixd on ltgt th of next month i know its really shocking bthmm njan vilikkamt ws al of a sudn
0,ok
0,please reserve ticket on saturday eve from chennai to thirunelvali and again from tirunelvali to chennai on sunday evei already see in netno ticket availablei want to book ticket through tackle
1,you are guaranteed the latest nokia phone a 40gb ipod mp3 player or a 500 prize txt word collect to no 83355 ibhltd ldnw15h 150pmtmsgrcvd18
0,see you then were all christmassy here
0,dunno cos i was v late n when i reach they inside already but we ate spageddies lor its e gals who r laughing at me lor
0,friendship is not a game to play it is not a word to say it doesnt start on march and ends on may it is tomorrow yesterday today and e
0,love it i want to flood that pretty pussy with cum
0,hey you got any mail
0,wheres mummys boy is he being good or bad is he being positive or negative why is mummy being made to wait hmmmm
0,im not sure if its still available though
0,hey happy birthday
0,peteis this your phone still its jenny from college and leannewhat are you up to now
0,been running but only managed 5 minutes and then needed oxygen might have to resort to the roller option
1,ur ringtone service has changed 25 free credits go to club4mobilescom to choose content now stop txt club stop to 87070 150pwk club4 po box1146 mk45 2wt
0,ok
0,its ok lar u sleep early too nite
0,da is good good playerwhy he is unsold
1,you have been specially selected to receive a 3000 award call 08712402050 before the lines close cost 10ppm 16 tcs apply ag promo
0,great i have to run now so ttyl
0,not enufcredeit tocallshall ileave uni at 6 get a bus to yor house
0,kent vale lor wait 4 me there ar
1,hi there 2nights ur lucky night uve been invited 2 xchat the uks wildest chat txt chat to 86688 now 150pmsgrcvdhgsuite3422landsroww1j6hl ldn 18yrs
0,pleassssssseeeeee tel me v avent done sportsx
1,freemsg our records indicate you may be entitled to 3750 pounds for the accident you had to claim for free reply with yes to this msg to opt out text stop
1,monthly password for wap mobsicom is 391784 use your wap phone not pc
0,the greatest test of courage on earth is to bear defeat without losing heartgn tc
0,edison has rightly said a fool can ask more questions than a wise man can answer now you know why all of us are speechless during viva gmgngegnt
0,good morning princess how are you
0,pls go ahead with watts i just wanted to be sure do have a great weekend abiola
0,lol i know theyre so dramatic schools already closed for tomorrow apparently we cant drive in the inch of snow were supposed to get
0,or remind me in a few hrs
1,free for 1st week no1 nokia tone 4 ur mobile every week just txt nokia to 8077 get txting and tell ur mates wwwgetzedcouk pobox 36504 w45wq 16 norm150ptone
0,i need you to be in my strong arms
0,derp which is worse a dude who always wants to party or a dude who files a complaint about the three drug abusers he lives with
0,im used to it i just hope my agents dont drop me since ive only booked a few things this year this whole me in boston them in nyc was an experiment
0,cause im not freaky lol
0,no im good for the movie is it ok if i leave in an hourish
0,is that seriously how you spell his name
0,i plane to give on this month end
0,i know complain num onlybettr directly go to bsnl offc nd apply for it
0,i don wake since i checked that stuff and saw that its true no available spaces pls call the embassy or send a mail to them
0,hope you are feeling great pls fill me in abiola
0,sicomo nolistened2the plaid albumquite gdthe new air1 which is hilariousalso boughtbraindancea compofstuff on aphexs abelu hav2hear itc u sn xxxx
0,tell me pa how is pain de
0,no he didnt spring is coming early yay
0,good good job i like entrepreneurs
0,networking job is there
0,oh ho is this the first time u use these type of words
0,for my family happiness
0,solve d case a man was found murdered on ltdecimalgt ltgt afternoon 1his wife called police 2police questioned everyone 3wife siri was sleeping when the murder took place 4cook i was cooking 5gardener i was picking vegetables 6housemaid i went 2 d post office 7children we went 2 play 8neighbour we went 2 a marriage police arrested d murderer immediately whos it reply with reason if u r brilliant
0,good afternoon my love how goes your day what are you up to i woke early and am online waiting for you hmmm italian boy is online i see grins
0,thats the thing with apes u can fight to the death to keep something but the minute they have it when u let go thats it
0,headin towards busetop
0,for many things its an antibiotic and it can be used for chest abdomen and gynae infections even bone infections
0,just looked it up and addie goes back monday sucks to be her
0,sorry ill call you later i am in meeting sir
0,mostly sports typelyk footblcrckt
0,youre right i have now that i think about it
0,india have to take lead
0,look at the fuckin time what the fuck you think is up
1,urgent we are trying to contact you last weekends draw shows that you have won a 900 prize guaranteed call 09061701851 claim code k61 valid 12hours only
0,get me out of this dump heap my mom decided to come to lowes boring
0,i had askd u a question some hours before its answer
0,i think just yourself thanks and see you tomo
0,you busy or can i come by at some point and figure out what were doing tomorrow
0,pls give her the food preferably pap very slowly with loads of sugar you can take up to an hour to give it and then some water very very slowly
1,you are being contacted by our dating service by someone you know to find out who it is call from a land line 09050000878 pobox45w2tg150p
0,then wait 4 me at bus stop aft ur lect lar if i dun c then i go get my car then come back n pick
0,my sort code is and acc no is the bank is natwest can you reply to confirm ive sent this to the right person
0,remember all those whom i hurt during days of satanic imposter in meneed to pay a priceso be itmay destiny keep me going and as u said pray that i get the mind to get over the same
0,whats up bruv hope you had a great break do have a rewarding semester
0,those were my exact intentions
0,hicts employee how are you
0,if you dont respond imma assume youre still asleep and imma start calling n shit
0,happy birthday may u find ur prince charming soon n dun work too hard
0,im on the bus love you
0,already one guy loving you
0,i had it alreadysabarish asked me to go
0,gods love has no limit gods grace has no measure gods power has no boundaries may u have gods endless blessings always in ur life gud ni8
0,i thank you so much for all you do with selflessness i love you plenty
1,private your 2003 account statement for shows 800 unredeemed s i m points call 08719899230 identifier code 41685 expires 071104
0,im in class did you get my text
0,645
0,i need details about that online job
0,im home ard wat time will u reach
0,sure but make sure he knows we aint smokin yet
0,somebody should go to andros and steal ice
1,hot live fantasies call now 08707509020 just 20p per min ntt ltd po box 1327 croydon cr9 5wb 0870 is a national rate call
0,do you want bold 2 or bb torch
0,aight what time you want me to come up
0,miss call miss call khelate kintu opponenter miss call dhorte lage thats d rule one with great phone receiving quality wins
0,are you being good baby
0,rajipls do me a favour pls convey my birthday wishes to nimya pls today is her birthday
0,sad puppy noise
0,mum ive sent you many many messages since i got here i just want to know that you are actually getting them do enjoy the rest of your day
0,i miss you so much im so desparate i have recorded the message you left for me the other day and listen to it just to hear the sound of your voice i love you
1,urgent this is our 2nd attempt to contact u your 900 prize from yesterday is still awaiting collection to claim call now 09061702893
0,when you came to hostel
0,no youll just get a headache trying to figure it out u can trust me to do the math i promise o
0,anything lor but toa payoh got place 2 walk meh
0,ok im coming home now
0,also track down any lighters you can find
0,actually i deleted my old websitenow i m blogging at magicalsongsblogspotcom
0,im now but have to wait till 2 for the bus to pick me
0,thats fine ill bitch at you about it later then
0,surly ill give it to you while coming to review
0,ive sent my part
0,hi hope you had a good day have a better night
0,shuhui say change 2 suntec steamboat u noe where where r u now
0,i dont want to hear anything
0,wow i love you sooo much you know i can barely stand it i wonder how your day goes and if you are well my love i think of you and miss you
0,ok
0,i cant pick the phone right now pls send a message
0,pls send me the correct name da
0,thanx u darlinim cool thanx a few bday drinks 2 nite 2morrow off take care c u soonxxx
0,2marrow only wed at ltgt to 2 aha
0,hi you just spoke to maneesha v wed like to know if you were satisfied with the experience reply toll free with yes or no
0,its a laptop take it with you
0,a famous quote when you develop the ability to listen to anything unconditionally without losing your temper or self confidence it means you are married
0,jus finish my lunch on my way home lor i tot u dun wan 2 stay in sch today
0,awesome text me when youre restocked
0,if i was i wasnt paying attention
1,urgent your mobile no 07xxxxxxxxx won a 2000 bonus caller prize on 020603 this is the 2nd attempt to reach you call 09066362231 asap box97n7qp 150ppm
0,pls give her prometazine syrup 5mls then ltgt mins later feed
1,goal arsenal 4 henry 7 v liverpool 2 henry scores with a simple shot from 6 yards from a pass by bergkamp to give arsenal a 2 goal margin after 78 mins
0,yes i come to nyc for audiitions and am trying to relocate
0,that means from february to april ill be getting a place to stay down there so i dont have to hustle back and forth during audition season as i have since my sister moved away from harlem
0,have you had a good day mine was really busy are you up to much tomorrow night
0,yesterday its with me only now am going home
0,did he say how fantastic i am by any chance or anything need a bigger life lift as losing the will 2 live do you think i would be the first person 2 die from n v q
