label,message
0,i love to give massages i use lots of baby oil what is your fave position
0,hey do u fancy meetin me at 4 at cha hav a lil beverage on me if not txt or ring me and we can meet up l8r quite tired got in at 3 vpist love pete x x x
0,hey babe hows it going did you ever figure out where your going for new years
0,thank you princess i want to see your nice juicy booty
0,good morning my dear shijutta have a great amp successful day
1,free nokia or motorola with upto 12mths 12price linerental 500 free xnet mins100txtmth free btooth call mobileupd8 on 08001950382 or call 2optoutd3wv
0,jolly good by the way will give u tickets for sat eve 730 speak before then x
1,auction round 4 the highest bid is now 54 next maximum bid is 71 to bid send bids e g 10 to bid 10 to 83383 good luck
0,anytime
1,free ring tone just text polys to 87131 then every week get a new tone 0870737910216yrs only 150wk
0,send ur birthdate with month and year i will tel u ur life partners name and the method of calculation reply must
0,i know im lacking on most of this particular dramastorms details but for the most part im not worried about that
1,free msg get gnarls barkleys crazy ringtone totally free just reply go to this message right now
0,geeeee your internet is really bad today eh
0,got but got 2 colours lor one colour is quite light n e other is darker lor actually im done shes styling my hair now
0,i think ive fixed it can you send a test message
0,i forgot 2 ask all smth theres a card on da present lei how all want 2 write smth or sign on it
0,thanks for understanding ive been trying to tell sura that
0,aiyo u so poor thing then u dun wan 2 eat u bathe already
0,mean its confirmed i tot they juz say oni ok then
0,ya i knw u vl givits ok thanks kanoanyway enjoy wit ur family wit 1st salary
0,oic cos me n my sis got no lunch today my dad went out so dunno whether 2 eat in sch or wat
0,why are u up so early
0,yo dude guess who just got arrested the other day
1,as a valued customer i am pleased to advise you that following recent review of your mob no you are awarded with a 1500 bonus prize call 09066368470
0,dude how do you like the buff wind
0,4 oclock at mine just to bash out a flat plan
0,my planning usually stops at find hella weed smoke hella weed
0,now press conference da
0,a bloo bloo bloo ill miss the first bowl
0,ive got ltgt any way i could pick up
1,great new offer double mins double txt on best orange tariffs and get latest camera phones 4 free call mobileupd8 free on 08000839402 now or 2stoptxt tcs
0,my supervisor find 4 me one lor i thk his students i havent ask her yet tell u aft i ask her
0,tadaaaaa i am home babe are you still up
0,den only weekdays got special price haiz cant eat liao cut nails oso muz wait until i finish drivin wat lunch still muz eat wat
0,okie
0,from tomorrow onwards eve 6 to 3 work
1,ur going 2 bahamas callfreefone 08081560665 and speak to a live operator to claim either bahamas cruise of2000 cash 18only to opt out txt x to 07786200117
0,can a not
0,i am real baby i want to bring out your inner tigress
0,hi its kate how is your evening i hope i can see you tomorrow for a bit but i have to bloody babyjontet txt back if u can xxx
0,do u noe wat time e place dat sells 4d closes
0,lara said she can loan me ltgt
1,hello from orange for 1 months free access to games news and sport plus 10 free texts and 20 photo messages reply yes terms apply wwworangecoukow
1,shop till u drop is it you either 10k 5k 500 cash or 100 travel voucher call now 09064011000 ntt po box cr01327bt fixedline cost 150ppm mobile vary
0,becoz its ltgt jan whn al the post ofice is in holiday so she cn go fr the post oficegot it duffer
0,sorry ill call later
0,do noe if ben is going
0,could you not read me my love i answered you
0,hello good week fancy a drink or something later
0,have a great trip to india and bring the light to everyone not just with the project but with everyone that is lucky to see you smile bye abiola
0,valuable affectionate loveable eternal noble truthful intimate natural enamous happy valentines day in advance
0,sure i am driving but will reach my destination soon
0,me not waking up until 4 in the afternoon sup
0,true deari sat to pray evening and felt soso i smsd you in some time
0,don no dawhats you plan
0,im serious you are in the money base
0,im back lemme know when youre ready
0,mode men or have you left
0,gosh that what a pain spose i better come then
1,warner village 83118 c colin farrell in swat this wkend warner village get 1 free med popcornjust show msgticketkioskvalid 4712 c tc kiosk reply sony 4 mre film offers
1,january male sale hot gay chat now cheaper call 08709222922 national rate from 15pmin cheap to 78pmin peak to stop texts call 08712460324 10pmin
1,please call our customer service representative on freephone 0808 145 4742 between 9am11pm as you have won a guaranteed 1000 cash or 5000 prize
0,ive told him that ive returned it that should i re order it
0,no shit but i wasnt that surprised so i went and spent the evening with that french guy i met in town here and we fooled around a bit but i didnt let him fuck me
0,im turning off my phone my moms telling everyone i have cancer and my sister wont stop calling it hurts to talk cant put up with it see u when u get home love u
1,you are being contacted by our dating service by someone you know to find out who it is call from a land line 09050000928 pobox45w2tg150p
0,uncle boye i need movies oh guide me plus you know torrents are not particularly legal here and the system is slowing down what should i do have a gr8 day plus have you started cos i dont meet you online how was the honey moon
0,i cant wait for cornwall hope tonight isnt too bad as well but its rock night shite anyway im going for a kip now have a good night speak to you soon
0,i cant pick the phone right now pls send a message
0,stupidits not possible
0,my computer just fried the only essential part we dont keep spares of because my fucking idiot roommates looovvve leaving the thing running on full ltgt 7
0,awesome plan to get here any time after like ltgt ill text you details in a wee bit
0,sometimes we put walls around our heartsnot just to be safe from getting hurt but to find out who cares enough to break the walls amp get closer goodnoon
0,the lay man just to let you know you are missed and thought off do have a great day and if you can send me bimbo and ugos numbers ill appreciate safe
0,nooooooo im gonna be bored to death all day cable and internet outage
1,dear uve been invited to xchat this is our final attempt to contact u txt chat to 86688
0,am on a train back from northampton so im afraid not im staying skyving off today ho ho will be around wednesday though do you fancy the comedy club this week by the way
0,pls she needs to dat slowly or she will vomit more
1,had your mobile 11mths update for free to oranges latest colour camera mobiles unlimited weekend calls call mobile upd8 on freefone 08000839402 or 2stoptxt
0,whatsup there dont u want to sleep
0,how are you my love are you with your brother time to talk english with him grins say hey muhommad penny says hello from across the sea
1,fancy a shag i dointerested sextextukcom txt xxuk suzy to 69876 txts cost 150 per msg tncs on website x
0,my love i hope your not doing anything drastic dont you dare sell your pc or your phone
1,oh my god ive found your number again im so glad text me back xafter this msgs cst std ntwk chg 150
1,this message is brought to you by gmw ltd and is not connected to the
0,no thank you youve been wonderful
0,please give it 2 or i will pick it up on tuesday evening about 8 if that is ok
0,shall i come to get pickle
1,hello we need some posh birds and chaps to user trial prods for champneys can i put you down i need your address and dob asap ta r
0,where in abj are you serving are you staying with dad or alone
0,im in a movie call me 4 wat
0,once free call me sir
0,al he does is moan at me if n e thin goes wrong its my faultal de arguments r my faultfed up of him of himso y bother hav 2go thanxxx
0,ya even those cookies have jelly on them
0,hey company elama po mudyadhu
0,wa ur openin sentence very formal anyway im fine too juz tt im eatin too much n puttin on weighthaha so anythin special happened
0,i sent you ltgt bucks
0,wat makes u thk ill fall down but actually i thk im quite prone 2 falls lucky my dad at home i ask him come n fetch me already
0,moon has come to color your dreams stars to make them musical and my sms to give you warm and peaceful sleep good night
0,found it enc ltgt where you at
0,havent mus ask if u can 1st wat of meet 4 lunch den u n him meet can already lor or u wan 2 go ask da ge 1st then confirm w me asap
0,especially since i talk about boston all up in my personal statement lol i woulda changed that if i had realized it said nyc it says boston now
0,his bday real is in april
0,the baskets gettin full so i might be by tonight
0,i dunno they close oredi not v ma fan
0,a bit of ur smile is my hppnss a drop of ur tear is my sorrow a part of ur heart is my life a heart like mine wil care for u forevr as my goodfriend
0,hey morning what you come to ask pa
0,aiyah ok wat as long as got improve can already wat
0,u studying in sch or going home anyway ill b going 2 sch later
0,o we cant see if we can join denis and mina or does denis want alone time
0,yes i think so i am in office but my lap is in room i think thats on for the last few days i didnt shut that down
1,no 1 polyphonic tone 4 ur mob every week just txt pt2 to 87575 1st tone free so get txtin now and tell ur friends 150ptone 16 reply hl 4info
0,mm not entirely sure i understood that text but hey ho which weekend
1,xmas prize draws we are trying to contact u todays draw shows that you have won a 2000 prize guaranteed call 09058094565 from land line valid 12hrs only
1,8007 25p 4 alfie moons children in need song on ur mob tell ur m8s txt tone charity to 8007 for nokias or poly charity for polys zed 08701417012 profit 2 charity
0,im in class will holla later
0,are you still playing with gautham
0,sorry ill call later
0,oh yeah clearly its my fault
0,how will i creep on you now
0,today is accept dayu accept me as brother sister lover dear1 best1 clos1 lvblefrnd jstfrnd cutefrnd lifpartnr belovd swtheart bstfrnd no rply means enemy
0,spoons it is then okay
0,s but not able to sleep
1,wan2 win a meetgreet with westlife 4 u or a m8 they are currently on what tour 1unbreakable 2untamed 3unkempt text 12 or 3 to 83049 cost 50p std text
0,itll be tough but ill do what i have to
0,cant think of anyone with spare room off top of my head
0,ok lor
0,but pls dont play in others life
0,haha awesome i might need to take you up on that what you doin tonight
1,please call our customer service representative on 0800 169 6031 between 10am9pm as you have won a guaranteed 1000 cash or 5000 prize
1,reply to win 100 weekly where will the 2006 fifa world cup be held send stop to 87239 to end service
0,the sign of maturity is not when we start saying big things but actually it is when we start understanding small things have a nice evening bslvyl
0,sorry ill call later
0,lol oh you got a friend for the dog
0,ive not called you in a while this is hoping it was l8r malaria and that you know that we miss you guys i miss bani big so pls give her my love especially have a great day
0,hi darlin im on helens fone im gonna b up the princes 2 nite please come up tb love kate
0,i will see in half an hour
0,not yet chikkuk then wat abt tht guy did he stopped irritating or msging to u
0,are u awake is there snow there
0,save yourself the stress if the person has a dorm account just send your account details and the money will be sent to you
1,ur tonexs subscription has been renewed and you have been charged 450 you can choose 10 more polys this month wwwclubzedcouk billing msg
0,kgive back my thanks
0,go chase after her and run her over while shes crossing the street
0,pls call me da what happen
0,eh ur laptop got no stock lei he say mon muz come again to take a look c got a not
0,that would be good ill phone you tomo lunchtime shall i to organise something
0,so pay first lar then when is da stock comin
0,hi darlin ive just got back and i had a really nice night and thanks so much for the lift see u tomorrow xxx
0,err cud do im going to at 8pm i havent got a way to contact him until then
0,howz that persons story
0,ok how you dear did you call chechi
0,somewhere out there beneath the pale moon light someone think in of u some where out there where dreams come true goodnite amp sweet dreams
0,good friends care for each other close friends understand each other and true friends stay forever beyond words beyond time gud ni8
0,i got arrested for possession at i shit you not lttimegt pm
0,thats a shame maybe cld meet for few hrs tomo
0,call me when ure done
0,weightloss no more girl friends make loads of money on ebay or something and give thanks to god
0,as per your request maangalyam alaipayuthe has been set as your callertune for all callers press 9 to copy your friends callertune
1,got what it takes 2 take part in the wrc rally in oz u can with lucozade energy text rally le to 61200 25p see packs or lucozadecoukwrc itcould be u
0,no but we found a diff farm shop to buy some cheese on way back now can i call in
0,and dont worry well have finished by march ish
0,you said to me before i went back to bed that you cant sleep for anything
1,this weeks savamob member offers are now accessible just call 08709501522 for details savamob pobox 139 la3 2wu only 150week savamob offers mobile
0,i donno its in your genes or something
0,good night my dear sleepwellamptake care
0,one small prestige problem now
1,orange customer you may now claim your free camera phone upgrade for your loyalty call now on 0207 153 9996 offer ends 14thmarch tcs apply optout availa
0,i like to think theres always the possibility of being in a pub later
0,don knowwait i will check it
0,120 that call cost which i guess isnt bad miss ya need ya want ya love ya
0,have you seen whos back at holby
0,full heat pa i have applyed oil pa
0,sorry brah just finished the last of my exams what up
0,aight text me when youre back at mu and ill swing by need somebody to get the door for me
0,or ill be a little closer like at the bus stop on the same street
1,themobyo yo yohere comes a new selection of hot downloads for our members to get for free just click open the next link sent to ur fone
1,new tones this week include 1mcflyall ab 2 sara jorgeshock 3 will smithswitch to order follow instructions on next message
0,erutupalam thandiyachu
1,22 146tf150p
1,orange brings you ringtones from all time chart heroes with a free hit each week go to ringtones pics on wap to stop receiving these tips reply stop
0,shit that is really shocking and scary cant imagine for a second def up for night out do u think there is somewhere i could crash for night save on taxi
1,you have 1 new voicemail please call 08719181503
1,1000s flirting now txt girl or bloke ur name age eg girl zoe 18 to 8007 to join and get chatting
0,k ill be sure to get up before noon and see whats what
0,u horrible gal u knew dat i was going out wif him yest n u still come n ask me
0,i shall book chez jules for half eight if thats ok with you
0,dear i am not denying your words please
0,plz note if anyone calling from a mobile co amp asks u to type ltgt or ltgt do not do so disconnect the callcoz it iz an attempt of terrorist to make use of the sim card no itz confirmd by nokia n motorola n has been verified by cnn ibn
0,so i asked hows anthony dad and your bf
0,predict wat time ll finish buying
0,hi its kate it was lovely to see you tonight and ill phone you tomorrow i got to sing and a guy gave me his card xxx
0,ok u can take me shopping when u get paid d
0,wat r u doing now
0,sorry about that this is my mates phone and i didnt write it love kate
1,private your 2003 account statement for shows 800 unredeemed s i m points call 08718738002 identifier code 48922 expires 211104
0,aight should i just plan to come up later tonight
0,wishing you a wonderful week
0,we regret to inform u that the nhs has made a mistakeu were never actually bornplease report 2 yor local hospital 2b terminatedwe r sorry 4 the inconvenience
0,just wait till end of march when el nino gets himself oh
0,once free call me sir i am waiting for you
0,dai ltgt naal eruku
0,gud ni8swt drmstake care
0,christmas is an occasion that is celebrated as a reflection of ur values desires affectionsamp traditions have an ideal christmas
0,prof you have passed in all the papers in this sem congrats student enna kalaachutaarama prof gud mrng
0,no da i am happy that we sit together na
1,natalja 25f is inviting you to be her friend reply yes440 or no440 see her wwwsmsacunat27081980 stop send stop frnd to 62468
0,i dont know same thing thats wrong everyso often he panicks starts goin on bout not bein good enough
0,yun buying but school got offer 2000 plus only
0,sweet heart how are you
0,oh just getting even with u u
0,sthis will increase the chance of winning
0,are you in town this is v important
0,wow v v impressed have funs shopping
0,oh kkwhere did you take test
0,i cant right this second gotta hit people up first
0,unfortunately ive just found out that we have to pick my sister up from the airport that evening so dont think ill be going out at all we should try to go out one of th
0,well imma definitely need to restock before thanksgiving ill let you know when im out
0,in da car park
0,babe im answering you cant you see me maybe youd better reboot ym i got the photo its great
0,oh ho is this the first time u use these type of words
0,got itmail panren paru
0,kkim going to tirunelvali this week to see my uncle i already spend the amount by taking dress so only i want moneyi will give it on feb 1
0,i am not at all happy with what you saying or doing
0,i also thk too fast xy suggest one not me u dun wan its ok going 2 rain leh where got gd
0,ok that would b lovely if u r sure think about wot u want to do drinkin dancin eatin cinema in out about up to u wot about
0,im in chennai velachery
0,nothing really just making sure everybodys up to speed
0,yup
0,should i head straight there or what
0,hi darlin im missin u hope you are having a good time when are u back and what time if u can give me a call at home jess xx
0,but your brother transfered only ltgt ltgt pa
0,fair enough anything going on
0,meeting u is my work tel me when shall i do my work tomorrow
0,good afternoon my love it was good to see your words on ym and get your tm very smart move my slave smiles i drink my coffee and await you
0,what todaysundaysunday is holidayso no work
0,is your hamster dead hey so tmr i meet you at 1pm orchard mrt
0,i was at bugis juz now wat but now im walking home oredi so late then reply i oso saw a top dat i like but din buy where r now
0,as usualiam fine happy amp doing well
0,ok thanx
0,yep get with the program youre slacking
0,hi darlin how was work did u get into trouble ijust talked to your mum all morning i had a really good time last night im goin out soon but call me if u can
0,thank u
0,fuuuuck i need to stop sleepin sup
0,yup i thk so until e shop closes lor
0,call me i am senthil from hsbc
0,my sister cleared two round in birla soft yesterday
0,im home
0,youll never believe this but i have actually got off at taunton wow
1,2p per min to call germany 08448350055 from your bt line just 2p per min check planettalkinstantcom for info ts cs text stop to opt out
0,check with nuerologist
0,stupidits not possible
0,yup but not studying surfing lor im in e lazy mode today
0,did u got that persons story
0,im gonna say no sorry i would but as normal am starting to panic about time sorry again are you seeing on tuesday
0,k fyi im back in my parents place in south tampa so i might need to do the deal somewhere else
0,were finally ready fyi
0,sir i need axis bank account no and bank address
0,how much for an eighth
0,we confirm eating at esplanade
0,no on the way home so if not for the long dry spell the season would have been over
0,was thinking about chuckin ur red green n black trainners 2 save carryin them bac on train
0,then what about further plan
0,tmr then brin lar aiya later i come n c lar mayb neva set properly got da help sheet wif
0,ok thanx
0,u definitely need a module from e humanities dis sem izzit u wan 2 take other modules 1st
0,dad wanted to talk about the apartment so i got a late start omw now
0,whos this am in class
0,oh god im gonna google nearby cliffs now
0,nope i just forgot will show next week
0,ill text carlos and let you know hang on
0,am not working but am up to eyes in philosophy so will text u later when a bit more free for chat
0,nothing just getting msgs by dis name wit different nos
0,solve d case a man was found murdered on ltdecimalgt ltgt afternoon 1his wife called police 2police questioned everyone 3wife siri was sleeping when the murder took place 4cook i was cooking 5gardener i was picking vegetables 6housemaid i went 2 d post office 7children we went 2 play 8neighbour we went 2 a marriage police arrested d murderer immediately whos it reply with reason if u r brilliant
0,oh ki think most of wi and nz players unsold
0,u sick still can go shopping
0,i have a rather prominent bite mark on my right cheek
0,dearshall mail tonitebusy in the streetshall update you tonitethings are looking okvarunnathu edukkukayee raksha ollubut a good one in real sense
0,yeah but which is worse for i
0,okok okthenwhats ur todays plan
0,u attend ur driving lesson how many times a wk n which day
0,thanx 4 the time weve spent 2geva its bin mint ur my baby and all i want is uxxxx
0,i just saw ron burgundy captaining a party boat so yeah
0,ummmawill call after check inour life will begin from qatar so pls pray very hard
0,aight do you still want to get money
0,you want to go
0,are you available for soiree on june 3rd
0,are you staying in town
0,so that means you still think of teju
0,sir good morning hope you had a good weekend i called to let you know that i was able to raise ltgt from my dad he however said he would make the rest available by mid feb this amount is still quite short and i was hoping you would help do have a good day abiola
1,final chance claim ur 150 worth of discount vouchers today text yes to 85023 now savamob member offers mobile t cs savamob pobox84 m263uz 300 subs 16
0,thats what i love to hear v see you sundayish then
0,ok im waliking ard now do u wan me 2 buy anything go ur house
0,yeah thats the impression i got
0,am going to take bath ill place the key in window
1,great new offer double mins double txt on best orange tariffs and get latest camera phones 4 free call mobileupd8 free on 08000839402 now or 2stoptxt tcs
0,wish u many many returns of the day happy birthday vikky
0,where are you call me
0,is that what time you want me to come
0,you in your room i need a few
0,sorry man my accounts dry or i would if you want we could trade back half or i could buy some shit with my credit card
0,tessypls do me a favor pls convey my birthday wishes to nimyapls dnt forget it today is her birthday shijas
0,goodmorning today i am late for 1hr
0,no but well do medical missions to nigeria
0,anyway holla at me whenever youre around because i need an excuse to go creep on people in sarasota
0,fighting with the world is easy u either win or lose bt fightng with some1 who is close to u is dificult if u lose u lose if u win u still lose
0,i dont know what to do to come out of this so only am ask questions like this dont mistake me
0,infact happy new year how are you where are you when are we seeing
0,im in inside officestill filling formsdon know when they leave me
0,sorry ill call later
0,no its not specialisation can work but its slave labor will look for it this month sha cos no shakara 4 beggar
0,text her if she doesnt reply let me know so i can have her log in
1,moby pub quizwin a 100 high street prize if u know who the new duchess of cornwall will be txt her first name to 82277unsub stop 150 008704050406 sp arrow
0,they finally came to fix the ceiling
0,hi di is yijue were meeting at 7 pm at esaplanade tonight
1,message important information for o2 user today is your lucky day 2 find out why log onto httpwwwurawinnercom there is a fantastic surprise awaiting you
0,youre gonna have to be way more specific than that
0,hey there babe how u doin wot u up 2 2nite love annie x
0,i dun believe u i thk u told him
1,new mobiles from 2004 must go txt nokia to no 89545 collect yours today from only 1 www4tcbiz 2optout 08718726270150gbpmtmsg18 txtauction
0,if youre still up maybe leave the credit card so i can get gas when i get back like he told me to
0,cthen i thk shd b enuff still got conclusion n contents pg n references ill b doing da contents pg n cover pg
1,hi babe its chloe how r u i was smashed on saturday night it was great how was your weekend u been missing me sp visionsmscom text stop to stop 150ptext
0,yes it completely in out of formclark also utter waste
0,sorry ill call later
0,hi i wont b ard 4 christmas but do enjoy n merry xmas
0,yo im right by yo work
0,chile please its only a ltdecimalgt hour drive for me i come down all the time and will be subletting febapril for audition season
0,u having lunch alone i now so bored
0,i know grumpy old people my mom was like you better not be lying then again i am always the one to play jokes
0,he is there you call and meet him
0,re your call you didnt see my facebook huh
0,what time do u get out
0,my house here e sky quite dark liao if raining then got excuse not 2 run already rite hee
